{
  "total_questions": 50,
  "per_question": [
    {
      "question_id": 1,
      "distribution": "factual",
      "question": "Nhân viên được nghỉ bao nhiêu ngày khi kết hôn?",
      "answer": "Không tìm thấy.",
      "contexts": [
        "Đoạn văn nằm trong phần quy định về phép nghỉ của tài liệu.\n\nPhép đặc biệt không cộng dồn và không chuyển sang năm sau. Các quyền lợi trên được tính theo ngày làm việc, không tính ngày nghỉ cuối tuần và ngày lễ. \"Ngày làm việc liên tục\" là các ngày làm việc kế tiếp nhau theo lịch làm việc của nhân viên.",
        "Đoạn văn nằm trong phần hướng dẫn về phép đặc biệt trong tài liệu nghi_phep_dac_biet.md.\n\nNhân viên cần cung cấp giấy tờ chứng minh trong vòng 5 ngày làm việc sau khi quay lại: giấy đăng ký kết hôn, giấy khai tử, giấy khai sinh. Trường hợp không cung cấp đầy đủ, số ngày nghỉ sẽ bị trừ vào phép năm. ## Lưu ý",
        "Tài liệu nghi_phep_khong_luong.md: Trích dẫn quy định liên quan.\n\nTrong thời gian nghỉ không lương, nhân viên không được hưởng lương và các khoản phụ cấp. Bảo hiểm y tế vẫn được duy trì nếu nghỉ dưới 14 ngày. Nghỉ trên 14 ngày, nhân viên cần tự đóng phần bảo hiểm của mình."
      ],
      "ground_truth": "Nhân viên được nghỉ 3 ngày làm việc có lương khi kết hôn, không trừ vào phép năm.",
      "faithfulness": 0.2,
      "answer_relevancy": 0.6694444444444445,
      "context_precision": 0.75,
      "context_recall": 0.3555555555555555
    },
    {
      "question_id": 2,
      "distribution": "factual",
      "question": "Bảo hiểm sức khỏe PVI có hạn mức bao nhiêu cho nhân viên?",
      "answer": "Bảo hiểm sức khỏe PVI có hạn mức 200.000.000 VNĐ/năm cho nhân viên.",
      "contexts": [
        "Đoạn văn nằm trong phần Chính sách bảo hiểm sức khỏe của tài liệu bao_hiem_suc_khoe.md.\n\n# Chính sách bảo hiểm sức khỏe > Phiên bản: 1.5 | Ngày hiệu lực: 01/04/2024 | Phòng ban: Nhân sự ## Bảo hiểm cho nhân viên Công ty cung cấp gói bảo hiểm sức khỏe toàn diện qua **PVI Insurance** cho tất cả nhân viên chính thức.",
        "Đoạn văn nằm ở phần mô tả về các gói bảo hiểm sức khỏe trong tài liệu.\n\nHạn mức bảo hiểm: **200.000.000 VNĐ/năm** bao gồm nội trú, ngoại trú và nha khoa. ## Gói gia đình Nhân viên có thể đăng ký thêm gói bảo hiểm cho người thân (vợ/chồng, con dưới 18 tuổi) với hạn mức **50.000.000 VNĐ/năm/người**.",
        "Tài liệu thu_viec.md: Trích dẫn quy định liên quan.\n\nNhân viên thử việc được tham gia bảo hiểm xã hội bắt buộc nhưng chưa được hưởng gói bảo hiểm sức khỏe PVI. ## Đánh giá thử việc Quản lý trực tiếp thực hiện đánh giá vào ngày thứ 30 (giữa kỳ) và ngày thứ 55 (cuối kỳ)."
      ],
      "ground_truth": "Hạn mức bảo hiểm sức khỏe PVI cho nhân viên là 200.000.000 VNĐ/năm, bao gồm nội trú, ngoại trú và nha khoa.",
      "faithfulness": 0.8363636363636363,
      "answer_relevancy": 0.8090909090909091,
      "context_precision": 0.75,
      "context_recall": 0.7545454545454545
    },
    {
      "question_id": 3,
      "distribution": "factual",
      "question": "Phụ cấp ăn trưa hàng tháng là bao nhiêu?",
      "answer": "Phụ cấp ăn trưa hàng tháng là 1.000.000 VNĐ.",
      "contexts": [
        "Đoạn văn nằm trong phần về quyền lợi và chi trả lương của nhân viên trong tài liệu.\n\nNhân viên chính thức được hưởng **lương tháng 13**, chi trả vào tháng 1 hàng năm (trước Tết Nguyên đán). Mức lương tháng 13 bằng 1 tháng lương cơ bản, tính pro-rata cho nhân viên chưa đủ 12 tháng. ## Phiếu lương",
        "Đoạn văn nằm trong phần quy tắc liên quan đến chương trình hỗ trợ nhân viên mới trong tài liệu mentor_buddy.md.\n\nBuddy là nhân viên cùng phòng ban, thâm niên từ 6 tháng. ## Quy tắc quan trọng Mentor và Buddy phải là **hai người khác nhau** để đảm bảo nhân viên mới có nhiều nguồn hỗ trợ đa dạng. Quản lý trực tiếp không được làm Mentor hoặc Buddy.",
        "Tài liệu phu_cap.md: Trích dẫn quy định liên quan.\n\n# Chính sách phụ cấp > Phiên bản: 2.1 | Ngày hiệu lực: 01/01/2024 | Phòng ban: Nhân sự ## Phụ cấp ăn trưa Tất cả nhân viên được hưởng phụ cấp ăn trưa **1.000.000 VNĐ/tháng**, chi trả cùng kỳ lương."
      ],
      "ground_truth": "Phụ cấp ăn trưa là 1.000.000 VNĐ/tháng, chi trả cùng kỳ lương.",
      "faithfulness": 0.85,
      "answer_relevancy": 0.825,
      "context_precision": 0.75,
      "context_recall": 0.8
    },
    {
      "question_id": 4,
      "distribution": "factual",
      "question": "Mentor và buddy của nhân viên mới có thể là cùng một người không? Quản lý trực tiếp có thể làm mentor không?",
      "answer": "Mentor và buddy của nhân viên mới **không thể là cùng một người**. Quản lý trực tiếp **không được làm Mentor hoặc Buddy**.",
      "contexts": [
        "Đoạn văn nằm ở phần mô tả vai trò của mentor và buddy trong tài liệu.\n\nMentor phải là nhân viên cấp Senior trở lên, khác phòng ban hoặc cùng phòng ban nhưng không phải quản lý trực tiếp. - **Buddy**: hỗ trợ **văn hóa và hòa nhập**, giúp nhân viên mới làm quen môi trường, giới thiệu đồng nghiệp, hướng dẫn quy trình hàng ngày.",
        "Đoạn văn nằm trong phần quy tắc liên quan đến chương trình hỗ trợ nhân viên mới trong tài liệu mentor_buddy.md.\n\nBuddy là nhân viên cùng phòng ban, thâm niên từ 6 tháng. ## Quy tắc quan trọng Mentor và Buddy phải là **hai người khác nhau** để đảm bảo nhân viên mới có nhiều nguồn hỗ trợ đa dạng. Quản lý trực tiếp không được làm Mentor hoặc Buddy.",
        "Đoạn văn nằm trong phần quy định về phép nghỉ của tài liệu.\n\nPhép đặc biệt không cộng dồn và không chuyển sang năm sau. Các quyền lợi trên được tính theo ngày làm việc, không tính ngày nghỉ cuối tuần và ngày lễ. \"Ngày làm việc liên tục\" là các ngày làm việc kế tiếp nhau theo lịch làm việc của nhân viên."
      ],
      "ground_truth": "KHÔNG cho cả hai. Mentor và buddy phải là hai người khác nhau. Quản lý trực tiếp không được làm mentor hoặc buddy.",
      "faithfulness": 0.8571428571428571,
      "answer_relevancy": 0.8333333333333334,
      "context_precision": 0.75,
      "context_recall": 0.8238095238095238
    },
    {
      "question_id": 5,
      "distribution": "factual",
      "question": "Muốn mua thiết bị trị giá 55 triệu cần ai phê duyệt?",
      "answer": "Không tìm thấy.",
      "contexts": [
        "Đoạn văn nằm trong tài liệu hướng dẫn quy trình mua sắm.\n\nĐính kèm ít nhất 3 báo giá cho đơn hàng trên 10.000.000 VNĐ 3. Chờ phê duyệt theo thẩm quyền tương ứng 4. Phòng Mua sắm đặt hàng và theo dõi giao nhận ## Lưu ý đặc biệt",
        "Đoạn văn nằm trong phần quy trình mua sắm thiết bị CNTT của tài liệu.\n\nMua sắm thiết bị CNTT (laptop, server, phần mềm) cần có xác nhận của phòng CNTT về cấu hình kỹ thuật trước khi đề xuất. Đơn hàng khẩn cấp có thể bỏ qua yêu cầu 3 báo giá nhưng phải có giải trình bằng văn bản.",
        "Đoạn văn thuộc phần quy trình mua sắm trong tài liệu hướng dẫn về tài chính và hành chính.\n\n# Quy trình mua sắm > Phiên bản: 2.2 | Ngày hiệu lực: 01/04/2024 | Phòng ban: Hành chính & Tài chính ## Thẩm quyền phê duyệt | Giá trị đơn hàng | Người phê duyệt | |-------------------|-----------------| | Dưới **5.000.000 VNĐ** | Trưởng phòng (Manager) |"
      ],
      "ground_truth": "Đơn hàng trên 50.000.000 VNĐ cần Tổng Giám đốc (CEO) phê duyệt.",
      "faithfulness": 0.2,
      "answer_relevancy": 0.65,
      "context_precision": 0.75,
      "context_recall": 0.3
    },
    {
      "question_id": 6,
      "distribution": "factual",
      "question": "Thông tin lương thuộc cấp độ phân loại dữ liệu nào?",
      "answer": "Thông tin lương thuộc cấp độ phân loại dữ liệu **Bí mật**.",
      "contexts": [
        "Đoạn văn nằm trong tài liệu về bảo mật thông tin liên quan đến sự cố.\n\nThông tin chi tiết sự cố được phân loại **Bí mật**; thông tin liên quan mã nguồn core, bí mật thương mại hoặc kế hoạch M&A thuộc **Tối mật** theo chính sách phân loại dữ liệu.",
        "Đoạn văn nằm trong phần hướng dẫn về quy trình chi trả lương trong tài liệu.\n\nPhiếu lương điện tử được gửi qua email công ty vào ngày chi trả. Thắc mắc về lương liên hệ phòng Tài chính trong vòng 5 ngày làm việc. Thông tin lương là dữ liệu **Bí mật**, cấm chia sẻ với đồng nghiệp.",
        "Tài liệu phan_loai_du_lieu.md: Trích dẫn quy định liên quan.\n\n# Chính sách phân loại dữ liệu > Phiên bản: 1.0 | Ngày hiệu lực: 01/06/2024 | Phòng ban: CNTT & An ninh thông tin ## Bốn cấp độ phân loại | Cấp độ | Nhãn | Ví dụ | |--------|------|-------| | 1 | **Công khai** | Thông tin marketing, bài blog, tuyển dụng |"
      ],
      "ground_truth": "Theo quy chế chi trả lương, thông tin lương được phân loại là dữ liệu Bí mật (cấp 3), cấm chia sẻ với đồng nghiệp. Phải mã hóa khi truyền và hạn chế truy cập theo need-to-know.",
      "faithfulness": 0.76,
      "answer_relevancy": 0.72,
      "context_precision": 0.75,
      "context_recall": 0.5
    },
    {
      "question_id": 7,
      "distribution": "factual",
      "question": "Nghỉ phép không lương 20 ngày cần ai phê duyệt?",
      "answer": "Nghỉ phép không lương 20 ngày cần phê duyệt của Giám đốc điều hành (CEO).",
      "contexts": [
        "Đoạn văn nằm trong phần quy định về nghỉ phép trong tài liệu nghi_phep_khong_luong.md.\n\nNghỉ từ 1-5 ngày: trưởng phòng phê duyệt. Nghỉ từ 6-15 ngày: cần thêm phê duyệt của Giám đốc Nhân sự. Nghỉ từ 16-30 ngày: cần phê duyệt của **Giám đốc điều hành (CEO)**. ## Ảnh hưởng đến phúc lợi",
        "Đoạn văn nằm ở phần quy định về nghỉ phép không lương trong tài liệu.\n\nThời gian nghỉ phép không lương tối đa là **30 ngày** trong một năm dương lịch. Nghỉ phép không lương không được tính thâm niên. ## Quy trình phê duyệt Đơn xin nghỉ phép không lương phải được nộp trước ít nhất 7 ngày làm việc.",
        "Tài liệu nghi_phep_khong_luong.md: Trích dẫn quy định liên quan.\n\nTrong thời gian nghỉ không lương, nhân viên không được hưởng lương và các khoản phụ cấp. Bảo hiểm y tế vẫn được duy trì nếu nghỉ dưới 14 ngày. Nghỉ trên 14 ngày, nhân viên cần tự đóng phần bảo hiểm của mình."
      ],